{
  "project_code": "WX-YGJ",
  "work_item_id": "PT083",
  "generated_from": [
    "inputs/images/PT083-01_副本.png",
    "inputs/images/PT083-02_副本.png",
    "inputs/images/PT083-03-01_副本.png",
    "inputs/images/PT083-03-02_副本.png",
    "inputs/images/PT083-03-03_副本.png",
    "inputs/images/PT083-04_副本.png"
  ],
  "images": [
    {
      "image_id": "IMG-PT083-001",
      "source_file": "inputs/images/PT083-01_副本.png",
      "page_name": "需求介绍",
      "sections": [
        {
          "section_name": "云机免费体验背景",
          "section_type": "other",
          "evidence_source_type": "explicit_text",
          "raw_text": "日新增用户的盒子引入率约17%，云挂机前三日覆盖率约3%～4%；两轮免费领云机活动约引导100名新用户破冰，破冰率从3%提升到10%，其中60%的用户购买了周卡及以上商品。",
          "ocr_text": "云机免费体验；日新增用户盒子引入率约17%；前三日覆盖3%～4%；两轮活动约100名新用户破冰；破冰率3%到10%；60%购买周卡+商品。",
          "visual_elements": ["需求介绍标题", "背景章节", "两条免费领云机活动复盘链接名称"],
          "interactive_entries": ["免费领云机第二轮活动复盘链接", "免费领云机第三轮活动复盘链接"],
          "section_rules": [
            "图片只展示活动复盘链接名称，没有可访问URL或正文",
            "背景数据没有定义免费体验资格、时长、次数或活动周期"
          ],
          "field_candidates": [],
          "field_rules": [],
          "field_rule_tables": [],
          "confidence": 0.94,
          "needs_confirmation": true,
          "ambiguity_reason": "两份活动复盘正文不可访问，免费体验业务规则未展开。"
        },
        {
          "section_name": "云机质量及尺寸问题",
          "section_type": "other",
          "evidence_source_type": "explicit_text",
          "raw_text": "云挂机画面模糊、卡顿不流畅，云机商定位原因为镜像、SDK版本过旧；多数用户需要脚本搭配云机使用，当前画面自动覆盖全屏，约70%的用户对720*1280画面尺寸有需求。",
          "ocr_text": "画面模糊、卡顿；镜像、SDK版本过旧；大多数用户需要脚本搭配云机；画面自动覆盖全屏；70%用户对720*1280有需求。",
          "visual_elements": ["画质问题说明", "脚本接入说明", "720*1280尺寸说明"],
          "interactive_entries": [],
          "section_rules": [
            "图片明确描述画面模糊和卡顿不流畅",
            "图片将镜像和SDK版本过旧列为定位原因",
            "图片没有提供SDK目标版本、脚本类型或画质量化验收标准"
          ],
          "field_candidates": [
            {
              "field_name": "cloud_machine_resolution",
              "display_name": "云机画面尺寸",
              "data_type": "string",
              "control_type": "display_text",
              "required": false,
              "editable": false,
              "default_value": "720*1280",
              "content_values": ["720*1280"],
              "data_source": "需求介绍图片",
              "notes": "未说明属于渲染分辨率、系统分辨率或展示容器尺寸。"
            }
          ],
          "field_rules": [],
          "field_rule_tables": [],
          "confidence": 0.95,
          "needs_confirmation": true,
          "ambiguity_reason": "720*1280技术层级、脚本接入方式和画质阈值未说明。"
        },
        {
          "section_name": "需求目的",
          "section_type": "other",
          "evidence_source_type": "explicit_text",
          "raw_text": "通过免费体验提升云机覆盖率；更新SDK改善画面模糊、卡顿；将画面尺寸固定为720*1280以支持脚本接入。",
          "ocr_text": "1. 免费体验提升覆盖率；2. 更新SDK改善画质模糊和卡顿；3. 尺寸固定720*1280支持脚本接入。",
          "visual_elements": ["目的章节", "三项目的列表"],
          "interactive_entries": [],
          "section_rules": [
            "免费体验目标为提升云机覆盖率",
            "更新SDK目标为改善画面模糊和卡顿",
            "画面尺寸固定为720*1280以支持脚本接入"
          ],
          "field_candidates": [],
          "field_rules": [],
          "field_rule_tables": [],
          "confidence": 0.99,
          "needs_confirmation": false,
          "ambiguity_reason": ""
        }
      ]
    },
    {
      "image_id": "IMG-PT083-002",
      "source_file": "inputs/images/PT083-02_副本.png",
      "page_name": "云挂机购买页",
      "sections": [
        {
          "section_name": "版本Tab",
          "section_type": "tab_area",
          "evidence_source_type": "explicit_text",
          "raw_text": "以下内容在各盒子的全新版Tab和常规版Tab下都需要更改。",
          "ocr_text": "常规版；全新版；两个Tab下都需要更改。",
          "visual_elements": ["常规版Tab", "全新版Tab"],
          "interactive_entries": ["切换常规版Tab", "切换全新版Tab"],
          "section_rules": ["本图所有区域改动同时适用于全新版Tab和常规版Tab"],
          "field_candidates": [],
          "field_rules": [],
          "field_rule_tables": [],
          "confidence": 0.99,
          "needs_confirmation": false,
          "ambiguity_reason": ""
        },
        {
          "section_name": "宣传图占位",
          "section_type": "display_area",
          "evidence_source_type": "explicit_text",
          "raw_text": "宣传图建议尺寸1008*160；图片来源于后台云手机商品管理的编辑宣传内容-宣传图片；需保证首屏普通区商品列表展示两个及以上商品。",
          "ocr_text": "宣传图占位；建议尺寸1008*160；图片源于编辑宣传内容；首屏普通区展示两个及以上商品。",
          "visual_elements": ["宣传图占位框", "轮播圆点"],
          "interactive_entries": [],
          "section_rules": [
            "宣传图建议尺寸为1008*160",
            "宣传图来自后台编辑宣传内容中的宣传图片",
            "首屏普通区商品列表需展示两个及以上商品"
          ],
          "field_candidates": [
            {
              "field_name": "promotion_image",
              "display_name": "宣传图片",
              "data_type": "image",
              "control_type": "display_text",
              "required": false,
              "editable": false,
              "format_rule": "建议尺寸1008*160",
              "data_source": "盒子管理后台-云挂机-云手机商品管理-编辑宣传内容-宣传图片",
              "notes": "图片显示轮播圆点，但未定义轮播、默认图或异常兜底。"
            }
          ],
          "field_rules": [],
          "field_rule_tables": [],
          "confidence": 0.98,
          "needs_confirmation": true,
          "ambiguity_reason": "轮播交互和默认图规则未说明。"
        },
        {
          "section_name": "宣传区",
          "section_type": "display_area",
          "evidence_source_type": "explicit_text",
          "raw_text": "增加宣传区，展示宣传口号和性能参数；数据来源于编辑宣传内容；后台一行可配置20个字符，C端超过一行时换行展示。",
          "ocr_text": "宣传区；展示宣传口号和性能参数；后台一行20字符；C端超过一行换行。",
          "visual_elements": ["宣传口号文案", "性能参数文案"],
          "interactive_entries": [],
          "section_rules": [
            "宣传区展示宣传口号和性能参数",
            "两个字段来自后台编辑宣传内容",
            "后台每项可配置20个字符",
            "C端超过一行时换行展示"
          ],
          "field_candidates": [
            {
              "field_name": "promotion_slogan",
              "display_name": "宣传口号",
              "data_type": "string",
              "control_type": "display_text",
              "required": false,
              "editable": false,
              "length_rule": "后台可配置20个字符",
              "format_rule": "C端超过一行时换行展示",
              "data_source": "编辑宣传内容-宣传口号"
            },
            {
              "field_name": "performance_parameters",
              "display_name": "性能参数",
              "data_type": "string",
              "control_type": "display_text",
              "required": false,
              "editable": false,
              "length_rule": "后台可配置20个字符",
              "format_rule": "C端超过一行时换行展示",
              "data_source": "编辑宣传内容-性能参数"
            }
          ],
          "field_rules": [],
          "field_rule_tables": [],
          "confidence": 0.98,
          "needs_confirmation": false,
          "ambiguity_reason": ""
        },
        {
          "section_name": "特价专区",
          "section_type": "display_area",
          "evidence_source_type": "explicit_text",
          "raw_text": "增加特殊区商品列表，区域名称为特价专区；展示现价、原价、商品名称、商品标签类型；后台未配置时隐藏；横向首屏展示2.5个，最多展示4个商品。",
          "ocr_text": "特价专区；后台无配置则隐藏；横排首屏2个半；最多4个商品。",
          "visual_elements": ["特价专区标题", "横向商品卡片", "商品标签", "现价", "原价"],
          "interactive_entries": [],
          "section_rules": [
            "后台未配置特殊区商品时隐藏特价专区",
            "展示现价、原价、商品名称、商品标签类型",
            "横向首屏展示2.5个，最多展示4个商品"
          ],
          "field_candidates": [
            {
              "field_name": "special_product_list",
              "display_name": "特殊区商品列表",
              "data_type": "array",
              "control_type": "display_text",
              "required": false,
              "editable": false,
              "content_values": ["现价", "原价", "商品名称", "商品标签类型"],
              "format_rule": "横向展示，首屏2.5个",
              "length_rule": "最多4个商品",
              "data_source": "盒子管理后台-云挂机-云手机商品管理",
              "conditional_visibility": "后台未配置特殊区商品时隐藏"
            }
          ],
          "field_rules": [
            {
              "field_name": "special_product_list",
              "display_name": "特殊区商品列表",
              "rule_text": "最多展示4个商品",
              "rule_type": "range_rule",
              "must_preserve_terms": ["最多展示4个商品"]
            }
          ],
          "field_rule_tables": [],
          "confidence": 0.99,
          "needs_confirmation": false,
          "ambiguity_reason": ""
        },
        {
          "section_name": "普通商品列表",
          "section_type": "list_area",
          "evidence_source_type": "explicit_text",
          "raw_text": "普通区商品列表为原商品列表，区域名称限时购买；纵向展示，商品数沿用之前逻辑；展示现价、原价、商品名称、商品标签类型；其余逻辑不变。",
          "ocr_text": "普通商品区；限时购买；竖排展示；商品数按之前逻辑；其余逻辑不变。",
          "visual_elements": ["限时购买标题", "纵向商品列表", "商品名称", "原价", "现价"],
          "interactive_entries": [],
          "section_rules": [
            "区域名称为限时购买",
            "纵向展示，商品数量沿用之前逻辑",
            "展示现价、原价、商品名称、商品标签类型",
            "其余逻辑不变"
          ],
          "field_candidates": [
            {
              "field_name": "regular_product_list",
              "display_name": "普通区商品列表",
              "data_type": "array",
              "control_type": "display_text",
              "required": false,
              "editable": false,
              "content_values": ["现价", "原价", "商品名称", "商品标签类型"],
              "format_rule": "纵向展示",
              "data_source": "盒子管理后台-云挂机-云手机商品管理",
              "notes": "“之前逻辑”和“其余逻辑”未在图片中展开。"
            }
          ],
          "field_rules": [],
          "field_rule_tables": [],
          "confidence": 0.98,
          "needs_confirmation": true,
          "ambiguity_reason": "原有商品数量和其他既有逻辑未定义。"
        }
      ]
    },
    {
      "image_id": "IMG-PT083-003-01",
      "source_file": "inputs/images/PT083-03-01_副本.png",
      "page_name": "盒子管理后台-云手机商品管理",
      "sections": [
        {
          "section_name": "云手机商品类型筛选",
          "section_type": "filter_area",
          "evidence_source_type": "visual_layout",
          "raw_text": "云手机商品类型：玩心盒子。",